B019VM3F2M|4.0|0|July 23, 2017|Functional and stylish.|As far as fitness trackers go, I find the Fitbit Blaze to be both functional and stylish.  In addition to acting as a pedometer, it also will take phone and text notifications and has a heart rate monitor that helps track calories burned and heart rate.  I find it interesting to see what my heart rate during different times of the day and it's superior to the Alta in recognizing workouts.  From reviews I've read, the HR monitor is fairly accurate though your mileage may vary and I do not take it as gospel. The major drawbacks that I've noticed so far are that my right wrist keeps getting a rash.  My left wrist does not react in the same way, so I'm not sure what's going on.  Additionally, I find the sleep tracker a bit inaccurate since when I feel I sleep better it says I've slept worse.  I sometimes have insomnia and it doesn't recognize the time I'm lying in bed trying to fall back asleep as my being awake. But as a way to move more and track activity, I do recommend the Blaze.
B019VM3F2M|4.0|2|March 12, 2016|Worth every penny!|I must say that this watch is pretty slick.  Not a lot of extras but everything you need in a fitness tracker.  I own a gym and am recommending our clients purchase fit bit products.  The only reason I gave it 4 stars instead of five is the extra step involved in getting to some of the info.  for example, depending on the screen, you will have to tap a couple of times to see your heart rate, when you are not exercising.  Overall, great product and worth buying.  I would recommend this to anyone interested in keeping track of daily stats and real time exercise stats.
B019VM3F2M|4.0|0|July 29, 2016|Be careful what you wish for!|I got my Fitbit Blaze working with a little trouble and a lot of technical help from Fitbit, but not much more than usual, given my modest status in the tech world. The Fitbit Blaze has  an amazing range of possibilities for the keep fit/keep healthy enthusiast but the key thing is to be sure, before you make the purchase, that you really want that much technology or are you actually just looking for a watch with some wrinkles, because the price is high (around $180). What bothers me increasingly is that there is also a considerable loss of your privacy if you set up the Fitbit to its full capability, because you have to enable the Fitbit to communicate the data it collects on you ("sync" it) to your account and your account can be accessed by Fitbit. I personally have concluded that I don't need all this technology but that was my mistake not Fitbit's, which is a very helpful company, its technical support is excellent and its online manual first-class.
B019VM3F2M|4.0|2|March 7, 2016|Job gets done|I just got my Fitbit Blaze and right away there are few things I believe are more of a nuisance and can be looked into to make it more effective for its users. First, there is nothing that tells you what needs to be done and I am not a psychic to know looking at a watch that says fitbit.com/setup under an arrow that I need to go online to that web address. A note or a small card containing step by step directions would be really helpful for users who aren't into tech stuff. I like the interface and how easy it was to sync it up to an online account once established. Again, would be nice if I was told I had to open an account. It's pretty neat once you get through minor hiccups initially. I wouldn't mind just a tad bit bigger screen and a better touch experience. However this gets the job done. So overall, it justifies the price, expected quirks, and room to improve. Definitely worth it when compare to Apple Watch
B019VM3F2M|4.0|0|March 6, 2017|Great product - but no instructions|I would've given a 5-star review but the product doesn't come with any instructions. I had to look up how to set up the product online and I have to continue to look the product up to find out different features and how to use those features. There were no instructions on how to remove the face of the watch from the band - I didn't even know it was removable until it popped out.  There were no instructions on how to charge the face either.  I figured it out from trial and error.  However, regarding the product itself, it's fantastic! I love that it keeps track of walking steps, climbing steps, miles, calories burned, alarms to remind me to eat, exercise routines, shows me my heart rate and so much more! I am a pre-diabetic and with that comes some out of the ordinary instructions to stay healthy and not cross over to full diabetes. I can log my food intake and the nutritional value as well.  You do have to download the app on your cell phone and some of the features do require you to log them on the app on your phone and not the watch.
B019VM3F2M|4.0|1|August 26, 2016|Easy to use fitness tracker and old-fashion watch.|PROS:A watch with some interchangeable apps.  I love how you can't get lost in it.  Sleeper cycle tracker is so very helpful as well as the activity options.  I ordered my activities based on frequency of use and easily switch them whenever I need too.  I get excited to see the steps go up throughout the day and find myself more aware of my hourly movements. Clean lines and bold style - I can wear it with anything in my closet and look forward to getting a leather band for it. CONS: I don't 'love' it because it can't get wet like a standard athletic watch.  Chasing a toddler around - I could use a little more durability. And as a deep sleeper, I don't feel the vibrations as a morning alarm, I wish it had a chime feature or a stronger vibration.
B019VM3F2M|4.0|0|August 18, 2017|Best of Both Worlds|Having had both a fitbit flex in the past as well as an original Moto 360 smart watch; this hands down is the best of both worlds! I'm very impressed with the quality of the watch and the battery life (so far I'm getting about 3 days with heavy use and notifications).  I was very surprised at how comfortable the stock band is; I didn't think I'd be able to sleep with it on, but it's actually not really noticeable.  The charger is a bit janky and it sucks you have to take the tracker out of the frame/band to charge it.  Also the notification syncing for (atleast for Android) seems a bit wonky, they show up fine on the tracker, but don't sync when dismissed on one device or the other. Another positive is that an aftermarket frame/band can really upgrade the look of your tracker.
B019VM3F2M|4.0|0|August 1, 2017|vast improvement over Charge HR|Previously had the Fitbit Charge HR, and for a nominal upcharge (I paid $140 for this, and $130 for the Charge HR), this is a WAY better tracker.  A few of the things I liked best about this model: 1. the separation between the unit and the band - the reason I had to throw away my Charge HR was because the band separated from the unit, which made the whole thing useless, even though the electronic piece still worked fine.  With the Blaze, a broken band can be easily replaced, and there are lots of 3rd party sellers out there so the bands are cheap 2. lots more functionality - different watch layouts, ability to choose exercise modes, call/text/email notifications, etc. 3. you get a touchscreen interface The only feature this unit doesn't have that I want is true waterproofing - I wish I could swim with it and feel secure that it won't break, but I don't want to take that $140 risk.  Like with any heartrate trackers in this price range, some people will complain that the heartrate monitoring isn't super accurate, but I think those folks expect too much from a product in this price range.  Last comment - unfortunately, my Blaze died after 6 months, but Fitbit's customer support was awesome, and made it super easy to request a replacement.  I would give it 4.5 stars if I could.
B019VM3F2M|4.0|1|September 21, 2016|I like it much better than the Surge|I had a Surge but got tired of the constant rash despite following the fitbit "skin care" guide, so decided to try out the Blaze.  I like it much better than the Surge, but apparently fitbit didn't learn their lesson from the many many complaining users and appear to have used the same band material.  I switched over to an off brand leather band which I love.  While I think the Blaze is a 5 star, knocking a star off as a product that costs this much and has had so many complaints should have a band that doesn't cause so many skin issues.  I am really not sure who the fitbit dermatologists are, but maybe a new group needs to be consulted.
B019VM3F2M|4.0|2|May 17, 2016|Pretty nice, but still needs work.  It's about the best there is now, 2016.|Much better than the fit bit HR.  Longer battery life, large dial, more sensitive to footsteps. Still, it doesn't register walking while pushing a shopping cart with your left hand.  Somewhat inaccurate on stairs, especially if you hold the banister with the watch hand. Still, better than the others I've heard about.
B019VM3F2M|4.0|1|June 6, 2016|One thing I recommend for any of the fit bits is to go ...|Enjoying it alot.  Using it to connect with other friends trying to move more.  The heart rate monitor is really helpful for me which is why I went with this model.  I saw someone else wearing it who showed me the extra features and since I do not normally wear a watch most folks don't know it is a fitbit at first look.  One thing I recommend for any of the fit bits is to go into settings and choose your own step goal.  The application defaults to 10K steps which for me is about 4 miles.  I know a bunch of folks that stopped using theirs because they got discouraged by the 10k.  Set your own goal and you may be much happier with the product long term.  I put mine at 5K and find it is just enough to get me out for a walk at night to finish off the goal.
B019VM3F2M|4.0|0|May 22, 2017|I'll admit I did feel something like tingling numbness|I purchased this somewhat hesitantly after reading reviews about the mysterious pain and tingling from some users. I charged it for about 4 hours before wearing to make sure that it was at 100%. When I first put it on, I'll admit I did feel something like tingling numbness, or possibly even a TENS unit. The pain stayed local to the area around the watch for maybe half a day, and then faded into kind of an ache that also presented in my shoulder. I can only think this has something to do with the way I carry my arm now, even though I wear it with my dominant arm. Regardless, I got it on Saturday and was wearing it all Saturday evening and Sunday, and as I write this review Monday afternoon I have no pain or soreness. I noticed the watches band is silicone, so when I sweat it tends to stick to me and is hard to remove. Battery life seems to be average, I predict based on my percentage now it will last till Thursday mid day. I purchased an Apple Watch series 2 previously, and miss the water resistance, but other than that it does exactly what I want it to do without the other tech distractions (like my apps) from the Apple Watch.
B019VM3F2M|4.0|0|March 7, 2017|a good option|This product is great. it does one important thing in my opinion, and that is that it keeps you active. because of this watch i am self-conscious of when i am being lazy on an specific day. to ear extra step i park further away when every i go out. i have walked around the neighborhood for hours listening to music because i was behind on my steps for the day. two things that i do not like that might be a deal breaker for some people are 1 - that it cannot be submerge as per the review that i have seen on you tube. so no showering or swimming with it. 2 - the charging device feels like it might break easily, thankfully they have a lot of option in amazon for replacements. my review of a good product is this. if it breaks, i will buy it again.
B019VM3F2M|4.0|0|December 19, 2016|Great product, too bulky for me|I will preface this by saying I am returning the Fitbit Blaze but not due to any problems! I've had the Fitbit one for 3 years now and finally decided I deserved an upgrade! I wanted one that would double up as a watch and get notifications from my phone so the blaze seemed like the perfect fit. I have M/L wrists so I thought it would be fine. The reason I decided to return it was it's just a little too big for my taste so I'm going to go with the Charge HR2. With all of that being said, the blaze itself is awesome! I love getting the notifications from my phone so I feel like I can walk away for it for long periods of time but not miss anything important. I really love that it also measures your heart rate and you can adjust your settings to whatever workout you are doing. If you don't mind a really big watch then this is a great choice!
B019VM3F2M|4.0|0|December 5, 2016|Pluses and minuses|I purchased this as a replacement for my Fitbit One and a basic smart watch. I had to uninstall and reinstall the Fitbit app on my phone to get it to connect the first time, but since then haven't had an issue. Getting phone notifications took me a while to figure out, as the Blaze showed as connected through Bluetooth but I wasn't getting the notifications. It was a simple solution (on the Blaze, under settings, Bluetooth classic had to be on then I could find it with my phone) and now notifications and syncing are working great. The downsides I've found are in tracking steps. If I'm grocery shopping and holding the cart, steps are not tracked. However, if I'm driving and have that hand on the bottom part of my steering wheel, steps are tracked. On a positive note, the heart rate matched the one on the treadmill (from their sensors) and also on the stationary bike. The distance for the treadmill was really close, though calorie burn estimates weren't. Of course, the weight I entered in the treadmill was accurate & I haven't recently updated my weight with Fitbit which could account for at least some of the difference.
B019VM3F2M|4.0|0|May 30, 2016|Really like the tracking capabilities of the Fitbit Blaze|Really like the tracking capabilities of the Fitbit Blaze, heart rate, steps, stairs and sleep to name a few. It's a sharp looking watch, I also purchased a silver wrist band to go with the black. The battery isn't the longest lasting, this lasts for about three days, but the charging of the device is simple, poop it out of the wrist band and into the charger, charge complete within a couple of hours. The only real complaint that I have, besides the relatively short battery life ( I have had a Fibit Charge and a Pebble, both have charges lasting about five days) is the watches notice/alarm vibration.  This device, when compared to my two previous devices, has a vibration that does the job but can be easily missed if you're preoccupied.  You knew when the alarms/vibration on my previous devices were going off, this one is not as noticeable. Still a very nice device.  I would recommend its purchase.
B019VM3F2M|4.0|1|May 11, 2016|Buy this watch TODAY!!!|I bought the Fitbit blaze on the reco on a friend who had the other Fitbit watch with the electrics integrated into the band, which he had to replace once or twice due to the band cracking over time. The blaze has not disappointed one bit. It tracks steps, syncs easily with my phone,, the only issue I have, and it is a small one, is that when I hold the handrails on the treadmill, it does not track my steps as well, c'est la vie. The band is great, it holds a charge for roughly 5 days. I did forget my charger while traveling, and an aftermarket charger was available on Amazon and it shipped quickly enough to arrive before my battery went dead. This has been a great addition to my workout regimen.
B019VM3F2M|4.0|0|July 7, 2017|List all the things you want from a fitness tracker first before choosing this one, lots of alternatives to this one|Seems to be more accurate than the other cheaper Fitbit Products.  You can't just shake your hands or wrist to get the steps. If you don't really care for the looks especially the watchfaces, I'd recommend the Alta HR or Charge 2 as you get the same technical stuff for the cheaper price.  The extra $50 (compared to the Charge 2) on the long run didn't really feel like a good value.  Music control and Notification didn't seem to be all that great especially if it doesn't want to work. The customization of the looks was bleak and the "watch" look got old.
B019VM3F2M|4.0|2|December 19, 2016|I like it but there are a couple set backs.|First of all, love this Fitbit. I wear it every day almost all day. Positives: -tells you where to improve -helps you reach your goals -comfterble -it looks nice Cons: -the metal scratches VERY easy. -it is not waterproof -dust and dirt shows very easy. -seems just a bit inaccurate. Overall, I do love this Fitbit and would choose this one over any of the others.
B019VM3F2M|4.0|1|July 15, 2016|Great watch for people who track their activities and sleep|I really like this smartwatch. I was mainly looking for an exercise/activity tracker that can also serve as a watch. Apple watch was too expensive and I recently made a switch to Galaxy S7 Edge, so I decided to go with the Fitbit Blaze. The most amazing feature is that it tracks your sleep automatically so you can just wear it after you shower at night and just fall asleep. It will automatically log your sleep data and sync it with your computer/phone/tablet. Only "flaw" of this watch, in my opinion, is that it is not water proof. This is a watch that I wear to the gym everyday and I wish I didn't have to take it off prior to showering and I wish I could wash my hands freely without worrying about getting too much water on this thing. Other reviews suggest, however, that one can wear this device in shower. I have not yet tried that myself.
B019VM3F2M|4.0|1|March 10, 2016|I'm very glad I decided to get this|As someone who was teetering between getting an Apple Watch and the Blaze, I'm very glad I decided to get this...So far I'm really enjoy it and it has all the fitness options I want without feeling like I'm connected to my cell phone all the time. The charge indeed DOES last about 5 days which I though was impressive and true to what the box said about it. I've gotten many comments on the sleekness of it, and personally I don't think it's any more bulky than a normal watch. Eventually I'll get a more casual band but I love the black one! Great product and I recommend it for anyone who's extremely active or looking for a nice fitness watch.
B019VM3F2M|4.0|2|March 3, 2016|It works great after you learn how to use it|Using the blaze with galaxy s6 edge. It works great after you learn how to use it. Two issues I have with it is it tends to respond rather slow sometimes. The other issue is the audio control sometime works. I found that disconnecting it from Bluetooth and reconnecting it would resolve the issue. FYI: text and call notification works fine on my phone but a friend using a nexus told me the notification does not always work and when making a phone call, the blaze will show that he is receiving a call from the person he is trying to call.
B019VM3F2M|4.0|2|August 24, 2016|It is a very useful workout tool and is pretty accurate with the readings|The fitbit blaze has worked well so far.  It is a very useful workout tool and is pretty accurate with the readings.  I have cleaned the wristband each night after use and have not run into any rash problems.  The reason I gave it 4 stars was because there are only 4 different watch faces to choose from and the battery only lasts a few days.  Other than that, this was a good investment for the price.
B019VM3F2M|4.0|0|April 25, 2017|One downside|I absolutely love the Surge along with the band style/size and the color. I did upgrade and this seems to suit my wants/needs better than my previous Fitbit. The previous two bands had separated/pulled away at the screen. I  submitted my first under the warranty...then the replacement gave me issues as well. This band isnt connected in the same way. I feel it was due to my wrist being in between the small and large only size options. ONE downside to this band is that I'm getting color transfer from my clothing and/or keyboard so it's starting to look dingy. I will be purchasing some off market bands to replace it!
B019VM3F2M|4.0|0|May 3, 2017|When it syncs, it's great|I've had this Fitbit now for at least 6 months.  I really like it, but the one thing that drives me crazy is that it's hit or miss when you go to sync it to your phone.  It will sync fine, then for some reason it won't sync no matter what you do.  I usually have to delete the watch and add it new to trick the phone into thinking it's new...and this usually works.  As with most technology, I think Bluetooth needs to be replaced with something more reliable.
B019VM3F2M|4.0|1|March 13, 2017|Good for the money.|Good watch and exercise tracker. Notifications does not function very well with my apple 5. Reboot gets it going but then when phone out of range it quits again. Restart will get it going again. No where near the functions of the Apple Watch but no where near the price either
B019VM3F2M|4.0|1|September 12, 2016|A Work in Progress|This is a good product which could be great.  Fitbit owners are people who are interested in tracking their fitness regimes.  Many of us like to swim and this product is not waterproof; I am not talking about SCUBA but surface swimming such as in a pool.  I swim laps for an hour three times a week and cannot track my progress for this period.  I like being able to easily track my activities, particularly my heart rate as I am recovering from open heart surgery.  Another reason for my less that top rating is that my Blaze is not as accurate as my Charge; I bought the Blaze to replace the Charge primarily due to its screen.  I know Fitbit has recently released Fitbit Flex 2 which is waterproof but it does not have a screen so that one can easily monitor the workout results; therefore I will not buy it.
B019VM3F2M|4.0|2|May 4, 2016|Replacement for my Charge HR and Pebble Watch|I had a Fitbit Charge HR and a Pebble Watch.  I upgraded to the Blaze in order to have everything on one device.  I have been reasonably happy, but there are a few functions that the Pebble performs better than the FitBit.  The vibration motor on the Pebble is much stronger than the one on Blaze.  I have a hard time noticing it when I am awake and there is no way the Blaze vibration alarm would wake me up.  The notifications function is not as reliable and full featured as the Pebble was, but that is a software issue that hopefully will be fixed soon.  Bottom line is that when I decided to go to one device, I knew that my choices were a smart watch that has added fitness tracking or a fitness tracker that has added smart watch functionality. I decided that I thought fitness tracking was more complex and more important to me and went with the Fitbit Blaze.  I am betting that it will be easier for Fitbit to upgrade the smart watch functionality to compete with the Pebble than it will be for Pebble to upgrade to match the Fitbit tracker functionality.  I am happy with the Blaze as my one device choice, but I am anxiously awaiting software updates from Fitbit.
B019VM3F2M|4.0|1|June 14, 2016|Great investment|This was a huge impulse buy, but I'm glad I did it. Lots of great features beyond the usual step/calories/time aspects. As a student nurse, I take my Fitbit with me on the unit (after cleaning it) and I use the stopwatch feature to take vitals. I love the plum band and that the watch allows me to specify whichever type of exercise I'm currently doing (elliptical, treadmill, running, etc) to get maximum accuracy. Also really enjoy the FitStar workouts available on the watch, although I wish there were more than just a few to choose from. Cons: Although I fit the watch to my wrist as per the instructions, the back of the watch face  keeps abrading my skin and causing redness and irritation. If I secure the band any looser it's much too loose for accuracy. I also find it exceedingly difficult to clean.
B019VM3F2M|4.0|1|August 29, 2016|Meets expectations.|It seems to be everything it says it is. It does pair with an Apple 6 phone and it is used to record activity, heart rate, and sleep analysis.  It is used to check incoming text messages and it can be recharged without difficulty.  The Blaze has a nice appearance and the case and strap can be changed. Like most new electronic products, it does take time to learn how to use it.  Getting started can take some time but if you have had an electronic smart watch before it will be learned quickly.  Someone with no experience could require help to get started.  I gave this watch to my wife and not being computer smart, she has learned to enjoy the watch.  Excellent choice.
B019VM3F2M|4.0|7|December 31, 2016|Easy and convenient|Works good so far, just hooked my Blaze up for its first charge. It didn't register as charging at first. I took it off and stuck the bottom in first, then pressed the top Blaze button before sliding into place on the charger base, then the blaze showed the charging logo. I like this base because it seems preferable than unclicking the Blaze Watch face every time to close in charging cord.. better to just place it on a base then just pop it off an continue wearing when done charging.
B019VM3F2M|4.0|1|July 3, 2017|Great for working out|I wanted a smatwatch that had a heartrate monitor, sleep tracking and would not need to be charged every day. This one fits the bill. Notifications are still a little off sometimes and do not come in right away. Over all it's a good smartwatch for the price and what it does.
