B01J24C0TI|4.0|0|July 4, 2017|Mixed opinions|I like the new show, but wish it had a larger screen or a port to attach to a tv screen. I also think the flash briefing should come with more video footage Rather than some of them just saying the new channel name. I think they should also contract with sling, Netflix or Hulu so you can also watch additional shows other than just what is on prime. Other wise we are happy with ours. I do think the price is a little high for what it is.
B01J24C0TI|4.0|0|August 15, 2017|Quality Show!|The Show has good sound quality. The interface is sometimes puzzling in trying to figure how to accomplish specific tasks, for example after pausing a prime video and going to the home screen, it isn't necessarily intuitive how to return to the video. Maybe an icon of what is active could appear when paused. I'm sure more capabilities are in the works.
B01J24C0TI|4.0|0|July 12, 2017|Great|Love screen....little disappointed in some of the content. Weather, music, etc. great. So need Amazon Music 3.99 month to get all songs
B01J24C0TI|4.0|0|July 12, 2017|Enjoying it so far, sometimes has a little trouble ...|Enjoying it so far, sometimes has a little trouble figuring out how to say what I want it to do. Will keep working with it and sure it will be exactly what I wanted
B01J24C0TI|4.0|0|July 12, 2017|learning the Echo Show|Love love the sound quality,  did not expect it to be as large as it is.  Haven't spent much time using it but that will change in the future.  At that point I will let you know.
B01J24C0TI|4.0|1|July 12, 2017|Get your  friends  and family  connected.|Worked  great with phone connection.  Still learning  of many other things sure as music.
B01J24C0TI|4.0|0|July 30, 2017|Broken Echo Nest Integration (Be Careful) - Disappointed with Customer Service|I am a huge fan of the echo devices and have multiple in the house. However was very disappointed at how customer service handled a issue that is genuinely in Amazon's best interest to resolve as quickly as possible. Amazon needs to be take notice and fix a major flaw in their integration with Nest before it breaks down a few A/C units. Video show the Nest thermostat being set to 50 degrees incorrectly.
B01J24C0TI|4.0|0|August 8, 2017|Good addition to alexa family.|Great new way to enjoy alexa. Still has some problems. I bought this thinking I can view my ezviz cameras . no way still trying . have to call support email was no help. I do feel all will work out. I will update when I find out more.
B01J24C0TI|4.0|0|July 26, 2017|Well Designed|Not fully functional yet, but the design is perfect. I asked it to play a video, and it played something I liked. Amazing. Would recieve five stars if it played well with other devices and had just a little more customization options. I should be able to fully setup anything without having to bring out my phone. This has a screen...
B01J24C0TI|4.0|0|July 22, 2017|Looks a little dated but we are very happy with it|We like it very much so far it's been our expectations we kind of wish it was a little more of a modern design it seems a little bulky and clunky but other than that it is a nice device and seems to work well
B01J24C0TI|4.0|0|July 12, 2017|Good|Yes for most part it has met my expectations, except I would like to download my videos and music from iTunes. Also like to see my email.
B01J24C0TI|4.0|0|July 12, 2017|Great product, the angle needs work.|Echo does a very good job at just about everything you ask. I rated it four stars because it's the weird angle the camera has. I had to put something behind it to prop for good video while the kids chat with the grandparents.
B01J24C0TI|4.0|0|July 31, 2017|Great improvement|All in all the echo show does whats advertised. And I looks good while doing it. I find some difficulty searching you tube and would love to be able to just push things to the screen like you can do with Apple TV and chrome cast. A little more explanation of what all this can do would be great. I upgraded from an original echo first gen so this is quite an improvement
B01J24C0TI|4.0|0|July 22, 2017|Very nice up grade!|This is certainly an upgade from the first round of echo products! Amazon could improve things a bit with a suggested list of commands that will work from the get go but, otherwise easy to set up and use. The drop in feature, now in the sotware, is good but not great as, I may be wrong on this, you may not refuse a drop in by using a verbal command. At least I have not found a way yet and, if there is a way, my problem could have been solved with a written manual...which does not exist except on line.
B01J24C0TI|4.0|0|August 25, 2017|Will buy again!!|Really enjoy the Echo Show....Some times has problems understanding me but that is just a process!  Convenient and it is great when you ask for a phone number and it shows it...Don't have to remember it.  Love to see the lyrics of a song too! No more peanut butter an flour on my phone or ipad keyboard either as it shows me a recipe and doesn't time out.  I would buy again and would definitely recommend it! I do not have a dot or other echo but love the Show and may just get another!!
B01J24C0TI|4.0|0|July 22, 2017|I bought it to replace a Sony Dash that is ...|I bought it to replace a Sony Dash that is no longer supported.  The Show provides about half the functionality as the Dash right now, but has a lot of promise as it evolves -- especially when linked with other Echo devices.
B01J24C0TI|4.0|0|July 12, 2017|Def nice to be able to see things instead of just ...|It does what is advertised.  Def nice to be able to see things instead of just hearing them...weather, music to choose from, movies/vids to choose from, etc.  Still needs more choices and also ways to connect to other Amazon devices like Fire TV and such.  Hope they keep adding more things to it as will def get more going forward...and if price goes down a bit too of course, lol.
B01J24C0TI|4.0|0|July 12, 2017|FUN|Having fun learning what she will and won't do. I was led to believe that I could connect to my Netflix but apparently I cannot do that yet. Otherwise i am pleased.
B01J24C0TI|4.0|1|July 13, 2017|Hoping for better sound|It works as advertised too.  I was hoping the speaker would be better,  it is slightly less robust than the original echo. At least that is my opinion having both and 4 echo dots.
B01J24C0TI|4.0|0|July 23, 2017|Neat idea!|So far, so good.  Nice to have visual feedback for weather and other answers. Fun to see lyrics of songs that are playing. Just like the other Echo products, I'm sure it will take time to learn all the capabilities this device has to offer.
B01J24C0TI|4.0|0|July 12, 2017|The Good & the Bad|The Good - Great screen, nice visuals and still does everything an Echo has in the past and more. The Bad - I feel a bit of bait & switch here because some of its coolest features like displaying song lyrics or even something as simple as having a folder of wallpapers on shuffle are for Prime Members only. I feel that if you are not a Prime Member, you only get to enjoy about 1/2 of what the device can do. I wish more of the "good stuff" were available to everyone who shelled out $225 for the device and not just for those who continue to give Amazon money monthly.
B01J24C0TI|4.0|0|July 12, 2017|Reaction is fast voice recognition is great even across the room|Reaction is fast voice recognition is great even across the room. However why too many "skills"  for my family to learn how to operate the alexia. Especially prime music and video. I am still learning
B01J24C0TI|4.0|0|September 19, 2017|I love tech toys and this one is fun|I love tech toys and this one is fun.  I would like Alexa to be a little more interactive.  Im sure the programmers are working hard on her updates so that some day she can carry on a conversation.
B01J24C0TI|4.0|0|July 22, 2017|Cool device, waiting for more skills.|Neat device. Way better than rev1. Still limited in skills, would love to see a lot more development in the skills that it can do. Right now not sure it's a $230 device, but I'm an early adopter.
B01J24C0TI|4.0|0|July 19, 2017|Very cool!|I am an electronic gadget junky, so I bought this without really knowing what I was getting.  Boy, was I pleasantly surprised!!  I'm still learning all the things Alexa can do for me, and I love it!
B01J24C0TI|4.0|0|July 12, 2017|This is really a great addition to the Echo line|This is really a great addition to the Echo line, but just like the Dot, being a first day adopter has burned us. My major decision point was the demo, pre sales video showing Ring integration which has recently been announced is not fully supported. Overall though I love it. The sound is awesome!!
B01J24C0TI|4.0|0|August 7, 2017|It had good reviews so i opted for the show|I originally wanted to purchase just a standard echo, but then did alittle  research on the echo show. It had good reviews so i opted for the show. Over all it's been pretty good. Still learning what all it can do. Not overly impressed with the speakers. I've listened the standard echo and it would appear that the speakers in the standard echo sound better. I would recommend the show in general. Not sure if additional speakers can be added.
B01J24C0TI|4.0|0|July 12, 2017|Cool device|Cool device.  It does everything that Echo can do.  The advantage is the display.  You can show movies, photos, and videos on it.  While playing songs, it shows the lyrics.  When on, the display shows your calendar, and news, etc.
B01J24C0TI|4.0|0|July 12, 2017|Nice upgrade|I enjoy it.great upgrade from Alexa.my small gripe is when I'm speaking to someone on the other end of the show when I said Alexa it activates the commands.need more names seeing that I have multiple devices in my house. Can't say anything else because I'm still getting use to it. But I do love the device especially it's compatible with my ring system.
B01J24C0TI|4.0|0|July 12, 2017|Everything about this device is speculator. Only reason it ...|Everything about this device is speculator. Only reason it gets just 4 stars is the angle of the camera. It points up too high for proper facial capture. Otherwise it is a KILLER!
B01J24C0TI|4.0|0|July 22, 2017|Good but can be better.|Works good and does more than I thought it would. However the original Alexa has better sound and noise blanker that the Show doesn't have.
B01J24C0TI|4.0|0|July 10, 2017|Waiting for further software improvement|Good product but still required further improvement on software / OS. Integration to Smartthings, WEMO, and Logitech Harmony are fine. Bass of the speaker is a bit too heavy, but fair. For using in non-US area, functions related to traffic, map and location can't be properly located and used.
B01J24C0TI|5.0|0|July 21, 2017|Love love love.|Our other echo went out and we had to have another one. Decided to spend the extra money for the Echo Show. Well worth it. We already have cameras hooked up through the show and the screen makes the whole Alexa experience even better. Takes things to the next level. Really awesome.
B01J24C0TI|5.0|0|July 24, 2017|Love the Show|This took the place of a "regular" Echo in our kitchen. So far this has done everything the Echo did, plus you get the bonus of a screen to provide you info. Timers are easier, recipes are available, lyrics are visible for songs and you can stream Amazon movies, etc - what more could you ask for?
B01J24C0TI|5.0|0|September 16, 2017|We absolutely love our Alexa Show|We absolutely love our Alexa Show.  If you have kids, here's all you need to hear:  Rather than answer the door, the kids just walk up to the Show and tell her, "Alexa show me the front door.."  They don't need to go to the door.  No one can tell they are home.  (Note:  You need an arlo camera system for this.)  They also love the karaoke style of presenting songs with lyrics.  Everything else is incidental.
B01J24C0TI|5.0|3|July 10, 2017|Waited years to buy an Echo and the Echo Show is TERRIFIC!!!|I waited to buy an Echo for the last couple of years and the Echo Show has exceeded my expectations. You will not be dissapoinred with this devices capabilities!
B01J24C0TI|5.0|0|July 15, 2017|90 yr old says he likes it|Bought it to keep in contact with 90 yr old father. Had relatives help set it up and have been using it for about a week - just video chats.  90 yr old likes it and so far has not had any problems using it, but we have not introduced any of the extra features as it may get too confusing for a guy who is not techno savvy.
B01J24C0TI|5.0|0|July 12, 2017|The Echo Show is cool for a tech filled house|I really like the Echo Show so far. I wish the screen was a little bit bigger, but not a big deal. I like that I can view my Arlo security cameras, really, really helpful. Pulling youtube videos is a cool feature. And accessing my photos is also really cool. A friend a I bought 2 and saved 100$ and that made us happy. Overall I am very pleased with the Echo Show. My fave feature at this point is the fact that I can access my Arlo security cameras, as stated above.
B01J24C0TI|5.0|0|September 6, 2017|Cool Product|Love my Echo show.  I have it in the bedroom and use it to set reminders, turn on/off lights, and to view my security cameras when they pick up detection.  It still has a way to go in being able to answer questions correctly, but overall, it's a cool product to have.  The only issues that I have had is when Alexa commercials come on the television and the Echo Show picks up the keyword.  lol
B01J24C0TI|5.0|0|July 22, 2017|Thank you Amazon!!!! Echo Show far exceeds my expectations every day!!!|I thought Kindle was the next evolution. I was wrong, this is the most intuitive device Amazon has developed. You'll begin learning how to use it from the moment you unpackage the device. Have trouble with technology? No worries, as Echo Show will help you along and tell you how to ask what you're looking for. Prime Music, shopping, local weather, news, audio books, videos, etc. etc. etc. - Take the chance, you won't regret a minute you spend with this beauty.
B01J24C0TI|5.0|0|July 12, 2017|Too much fun so far...|I've only had it a short time but I'm having a ball with this thing.  I bought two and sent one to my 83 year old mother so can call and see us when ever she feels like it. The skills are easy to install, if not easy to find.  I believe the interface for finding skills could be improved but that's really just a minor issue.
B01J24C0TI|5.0|0|July 24, 2017|Eye of the Storm|This sleek device was essential this weekend.  My wife and I recently acquired a beach house.  Not only did it prove to be the center of conversation with a number of family and friends but having a screen to watch Amazon Prime Movies kept the two kids entertained as we haven't had an opportunity to get a TV.  When the children weren't watching; the adults had as much fun pumping the tunes (mostly reggae and beach themed music). As a side note suggested to a brother-in-law that our mother-in-law could benefit from an Echo as her fingers are gnarled with rheumatoid arthritis.  Being able to call out "call Donna" would provide a semblance of control and connection. Now I'm getting familiar with using the Show to slideshow pictures via Amazon Drive Storage.
B01J24C0TI|5.0|0|July 23, 2017|Alexa on steroids!|Okay, since getting this, we haven't turn on our Echo again, we love having this in the kitchen. Playing music, videos for the kids, seeing the time and temp clearly. It's great! Sounds great when playing music, I do with the screen was slightly bigger, but for now, this is perfect!
B01J24C0TI|5.0|0|July 12, 2017|The "show" is just as wonderful as the Echo|Alexa! The "show" is just as wonderful as the Echo, but now you can see what she's talking about: news, lists, lyrics, etc. plus, the calling feature now becomes a video call or drop-in. I'd like to have more options for the home screen, but I'm sure they'll add to the features over time, just as they have been doing to the echo all along. :)
B01J24C0TI|5.0|0|August 26, 2017|LOVE IT!!!!!!|I love how this has helped automate my home. I also love that it get smarter every day and learn us more so we do not have to repeat ourselves. I also love how my 3 grandsons 600 miles away can easily call me and see me any time they want without their parents having to open a program or hold a phone for them.
B01J24C0TI|5.0|0|August 19, 2017|Best Echo Yet!|These are the best Echo's yet!  I finally bought six of them and gave one to my son.  The others are distributed around my house.  I recommend this version of the echo over the others if you are only getting one however the Echo dot is fantastic when connected to a high end stereo system.
B01J24C0TI|5.0|3|July 7, 2017|I like it, however I have not been able to ...|I like it, however I have not been able to enable to my contacts or message or make telephone calls, very disappointed, any help you can provide will be highly appreciated.
B01J24C0TI|5.0|3|July 2, 2017|I love it!|I love it!!  Because I'm so completely and enthusiastically satisfied with the Echo Dot, I pre-ordered the Show and have had it for 3 days now.  Installation was a snap and it connected itself to the Alexa app automatically.  I'm sure I'll find a zillion uses for it -- so far, I think it's great to be able to actually see my shopping list on the screen and I guess I just like "seeing" (as opposed to hearing) the weather, the name (amd lyrics) of the song that's playing and other things.  I just happened to find out about the "messaging" feature on Echo today and it works perfectly on this and the Dot.  I must say, I'm especially excited about having cameras at the front and back doors -- I've got two cameras on their way to me.  Once I have it all checked out and am using all the things it can do, I'll buy them for my grown nieces so they can talk to each other while they're making dinner (or whatever) in different towns.  Amazon does everything so extremely well and this is easily up to the very high standard they've created and we've all come to expect.  The Show is nice and heavy, so it's not going to be knocked off the table.  In that I happen to sit right here beside it a lot of the time, I'd like to be able to make the rolling prompts (for videos, etc) stop and let the screen just be dark -- sure as shootin' there's a setting or command for that, so I'm unconcerned.  Yes indeed, I love the Show!!!  I have to believe you will, too!!!
B01J24C0TI|5.0|0|August 2, 2017|If you own echo products, a must addition|I love this product so far.  Screen quality is very good.  Sound quality is very good.  If you enjoy echo products then you will like this.  Video chatting is great and more convenient than on my phone.  I have one in my kitchen and one in my bedroom which I use as my alarm clock and more.  Thinking of getting one more for my office at work.  I also own an echo dot which for the price it is a great product as well.
B01J24C0TI|5.0|5|July 3, 2017|I'm Loving' it!|I'm so glad that Amazon released this! Now Alexa will not just tell you what's happening, she will show you. I have one in my kitchen and my home office plus I plan on purchasing 2 more. My 2 most favorite features right now is that I have lyrics on the screen while listening to some of my favorite songs!! I'm dangerous now! LOL  Another thing I love is that it connects to my RING camera so I can monitor the outside of my house. I'm very happy with my purchase!.
B01J24C0TI|5.0|0|August 13, 2017|Echo, Tap, Dot, Show...have them all.|Just keeps getting better and better...buy 2 and save $100. A desktop clock that does apointments, reminders, plays  music, videos, news and is a security camera to boot. Just arrived today...will update when I get home All the negatives be quite...the Echo  got crapped on in the begining and look at it now.
B01J24C0TI|5.0|11|June 30, 2017|Exceeds my expectations|Many professional reviewers have come up a little short on this unit indicating it's not enough of this or too much of that. However, I don't see any of the indicated shortcomings as real. I think this is terrific, a great improvement over the tubular Echo. The display in combination with the Echo technology really brings it to another level of usefulness  Very excited to see what skills/apps will take advantage of this device moving forward. The Echo Show has raised the bar.
B01J24C0TI|5.0|0|August 20, 2017|Staying Connected Takes Another Step Further!|The Echo Show is great.  I had a couple of the Echo devices previously and really liked them so decided to try the Echo Show.  The addition of the screen really takes Alexa to the next level.  The best feature of the Show is the video calling and texting.  We've started using this quite a bit.  The camera video quality is excellent.  I actually bought a Show for my parents and all 3 of my grown children.  If we can't stay connected this way, then we have no excuses! My next step is to hook up the Echo Show to an outdoor video system for the house along with a couple of Smart Home devices.
B01J24C0TI|5.0|0|August 21, 2017|Saves a LOT of time when working out with a partner!!!! No need for long drives anymore!!|Using it for workouts with my bff and it works great!! We can workout together but don't have the long drive to each others house which saves us a ton of time, trying to get together for workouts after work. Also is great for face to face hands free conversations, of course. :-) Had no issues with it so far. So  - no complaints :-)
B01J24C0TI|5.0|0|August 6, 2017|Exited About the Future of this Product.|Found it more far more useful than expected. Bought 2, and can use as a visual intercom via the drop in feature.  Lock my self out of the house and used the amazon app on phone to drop in and get the family's attention inside (drop in on phone app works from on celluar data also).  Play mostly kids songs, kids videos, flash video briefings, audiobooks.  Finding very useful in daily life.  Found "hidden" setting by swiping from top very useful.  Also find annoying to always turn, thinking of buying some kind of lazy Susan turntable (probably should have been built in). FInal thought -  wish bigger.
B01J24C0TI|5.0|0|July 31, 2017|My Favorite!|I find the Echo Show to be such a delight ! And I'm just scratching the surface of all that it will do. Some day, when I have a spare day, I'd like to wear  Alexa out with requests. I even enjoy when she goofs up (speaks when not spoken to). She sings quite well too! I have tons of gadgets and the Echo  Show is by far my favorite.
B01J24C0TI|5.0|2|July 9, 2017|Nice addition to my security|So far everything seems to be fine I'm starting just to enjoy it
B01J24C0TI|5.0|0|September 19, 2017|Everyone Should Have One!|OMG! I love this thing!! I got it as a gift from my sister. I already had an Echo Dot, which I love as well!  The "Show" is like a whole new level of cool! We just went thru Hurricane Irma and I was saying the two things I missed the most was AC and Alexa. Everyone should have one of these!!
B01J24C0TI|5.0|0|July 12, 2017|better then apple pie|more then my best hopes.  i bought two , i am a senior  the pair enable me to feel secure allows me to see front door, included  allows me to see front room , the sound is great., the drop in call provide me the ability to make hands free calls. i chat with my granddaughter in college  face to face. i am learning new things every day
B01J24C0TI|5.0|0|July 16, 2017|Family Calendars, Video Chats, Weather!!  Alexa has gone to college/ charm school.|As Sony dropped support for our Dash boxes, this product came along at the perfect time.  New feature being discovered almost daily.  Love the fact you can video chat from iPhone to Show.  Easy to manage family Google calendar.  Can see Arlo video cameras.  Excited about the future potential add ons.  Wish it had an audio or hdmi output.
B01J24C0TI|5.0|1|July 14, 2017|First Echo. Super pumped for an assistant :)|First Echo product and I am very pleased. I had an issues with getting all of the "Skills" to work but after some research I had purchased the Echo with my second Amazon account and had the app setup with my main account. The resolution was to "deregister" the Echo on my second account and then register it onto my main account. Other then that small issues the Echo Show is amazing! I should have used that introduction sale for 2 Shows for $100 discount.
B01J24C0TI|5.0|0|August 14, 2017|We love The Echo Show|We love The Echo Show! Our granddaughters were moving away so we bought 2 and sent one with them. Being able to have them call us and see their sweet little faces is a major plus. It does every once in awhile spout out something when no one is near, but we figured it out, It was a fruit fly that would land on the screen.It is kind of funny because I was talking in the back of the house and she says I have added Shower Bagels to your list. Over all i fantastic purchase
B01J24C0TI|5.0|1|July 9, 2017|Echo Show is a very innovative product. The technology ...|Echo Show is a very innovative product. The technology installed in the show is very advanced and it's adaptive capabilities are endless.
B01J24C0TI|5.0|0|July 30, 2017|Works fantastic for video calls between us|Purchased the two pack for our distant daughter and ourselves. Works fantastic for video calls between us. We also enjoy the video flash briefings and the ability to watch specific items on You Tube. It controls all of our lights on the main floor and our television as well. In my opinion the speakers sound better on the Show than on the Echo. Only wish it was battery accessable as well. Overall a great product.
