B01DFKC2SO|2.0|0|July 22, 2017|Perhaps 3rd generation Echo Dot will do better.|Unlike Siri, Echo Dot does not understand Chinese, or any other language except English.  As a result, one cannot ask her to play songs/music which do not have an English title.  Also, Echo Dot have problem with slow speaking person.  She makes selections before one has a chance to finish one's requests.  But I guess for English-only speaking customers, she is alright. Perhaps 3rd generation Echo Dot will do better.
B01DFKC2SO|2.0|One|May 12, 2017|You would think by now it would be able to ...|You would think by now it would be able to answer questions but it doesn't even asked a simple question as what's the number one song out right now and she couldn't even answer it she said I don't know
B01DFKC2SO|2.0|0|August 17, 2017|Bad sound, worse microphone|I have the full sized Echo and love it. Got one of these for the bedroom to play kids music during bath+dress time. It mostly just wants to play games. It's like everything I say to it comes out as "let's play a game". Exiting the game often means I have to just walk over and unplug it. Fine concept, terrible quality.
B01DFKC2SO|2.0|0|July 28, 2017|Failing after 7 months|I got this for christmas and it worked wonderfully at first. At the 4 month mark, it began to have problems.  While standing 7-8 feet away it would have trouble hearing me in a quiet room.  The lights would light up indicating it detected my voice, but it would just turn off a few seconds later without responding.  Now at 7 months it rarely hears anything I say and I have to unplug/re-plug it in every day.  I like it fine, when it works, but lately it doesn't work often.
B01DFKC2SO|3.0|One|March 26, 2017|With a smart phone, an iPad, and a laptop, I found no real use for this.|With a smart phone, an iPad, and a laptop, I found no real use for this.  Also, with folks talking about their microwave ovens spying on them, I was uncomfortable with always have a continious open ear in the room, often offering unwanted comments or answers to questions not asked.  Returned.
B01DFKC2SO|3.0|0|July 26, 2017|One missing feature away from greatness.|Works about as well as the full sized Echo in terms of responsiveness. It can drop in on other Echo devices so you can use it as a household intercom, which is really neat. The sound quality is about the same as a smartphone, which is to be expected with its much smaller size. The good news is there's an AUX out, so with a mini to RCA Y cable you can easily plug it into your stereo, and it sounds great. The bad news is all of the audio comes out of either the Dot speaker OR the AUX out, never both. There's no way to have music sent through the AUX jack while Alexa responses like weather and calendar updates come out of the Dot speakers. This means you either have to have your stereo on all the time or plug in the Dot for music and then unplug it for general everyday use. This isn't a dealbreaker, but it's a pretty aggravating oversight.
B01DFKC2SO|3.0|0|July 24, 2017|Great product but Amazon needs to make some changes|Another great product from Amazon.  The only downer is the speaker doesn't pick up from more than a few feet away but I didn't buy it for a large room so it's perfect for what I wanted it for. Update:  I'd really love it if Amazon would allow multiple devices to stream their music, because this can't happen I will not buy another Dot or even an echo. Which is too bad because I had plans on buying one for each of our kids in their rooms since they love to listen to Amazon music.
B01DFKC2SO|3.0|One|May 26, 2017|Eh, I should have just gotten another Echo. The sound quality is lacking.|The sound is not at all like the Echo.  I am still on the fence if I want to return it and just buy another echo because of the sound quality.  It works for having an "extension" for your Echo to add things to your list(s), playing your music etc.
B01DFKC2SO|3.0|0|September 9, 2017|Meh.|We were excited to order this.. it was a novelty that wore off with the family very quickly. The voice recognition is alright, doesnt match even the Android's system. It cannot play music unless you have bought some in your amazon account.. it doesnt seem to search Youtube even. Sometimes when we watch TV, the Echo randomly wakes up, says nonsense and goes quiet again. The final straw was when one day we started getting an incoming call on the Echo (it was pulsing green and beeping intermittently). We had not informed anybody that we had an Echo at that time. Nowadays we just keep it unplugged.. not worth the hassle.
B01DFKC2SO|3.0|0|August 5, 2017|English only, work in progress not as useful as you might think|It's a nice toy but I have yet to find a useful application for it, the Echo Dot did not work with the brand of wifi connected thermostat I had installed in my house, also Alexa only understands English which is fine for me, but not for my in laws. I can get it to play whatever music I like from several sources Pandora Radio, SiruisXM, Amazon music or my own music collection, I can set an alarm or check the weather. My in laws can just turn it on adjust the volume and turn it off.
B01DFKC2SO|3.0|0|July 22, 2017|It is OK..|I love to listen to Indian classical music. Unfortunately this device does not recognize many of the popular artists. I am really disappointed with it. Today I received the Larger Echo. Hopefully Amazon will try to improve the list of international music artist list. Pandora seems to do a whole lot better job. Perhaps I need a tutorial to "educate" me to see if these devices have other featured\s that I am still not aware of.
B01DFKC2SO|3.0|0|August 16, 2017|Designed with the modern smart phone user in mind, Computer users beware|Designed with the modern smart phone user in mind. This product does not live up to what i was hoping for due to the poor support offered to computer users. I use a cheap cell phone and a 2000.00 desktop computer as my home entertainment device. I was expecting some type of app or program for the PC to enhance the echo and i got a poorly designed web page based app that is hard to navigate and offers limited interaction with the echo. You can not even make the most out of Amazon music unlimited because the music program does not interact with the Echo. You would think a forward thinking company like Amazon would have the foresight to cover all of its customers options equally. Amazon if you read this not everyone in the world lives their life dictated by an expensive cell phone that is basically a under powered small computer. Echo is a home entertainment device not a portable speaker that should require a cell phone. If you want to take this product to the next level take the energy you are wasting on cell phone apps and design a desktop computer app much like your music program that interacts with the echo, Then you will have the home entertainment device you are advertising
B01DFKC2SO|3.0|0|March 30, 2017|Not bad for $50|After having the Dot for a few weeks, I have to say Alexa doesn't know much! I ask simple questions and I get "Hmmm, I don't know how to answer that".  I put a series of questions to both Alexa and Ok Google and Google answered them all. Alexa couldn't answer any. I understand  you must enable skills, and I have, but for basic questions??? Google is the clear winner here. That being said, I pay for the Unlimited  music for $3.99 and basically use the Dot as a personal  DJ. I tell her what to play and she does it. For $50, it's a neat gadget, but my next gadget will be Google Home.
B01DFKC2SO|3.0|One|December 21, 2016|Ok, but waiting for updates to make it better.|For the most part we really love our Alexa.  It does a sorts of fun and helpful things. We have had some issues with the Nest and the Echo Dot not working together when it is supposed to and there are times when it just doesn't recognize commands even though we've don't tons of voice training with the device. I also find it mildly annoying that you can't just ask a question like,  "Alexa, what sound does a whale make?"  You have to ask her to "wikipedia" something instead and you don't get the specific info you asked for.  Kind of disappointed.  I hope they work on that feature.  I also hear that sonos is going to pair soon which will be nice.
B01DFKC2SO|3.0|2|December 11, 2016|it is ok|It doesn't do a lot. It drops from the wi-fi a lot,,,, some things such as finding stores is pretty cool and playing music .......... it's ok - nothing super exciting but can be helpful.
B01DFKC2SO|3.0|0|August 1, 2017|Great except recent update kills remote.|Bought this to use where my full Echo was having issues connecting to speakers. From that perspective, it works well. My only complaint, and while it may be "minor" to some, it is a major inconvenience for the application this was purchase for. The Dot was working with the remote, but for some reason, it now no longer does. Going through the configuration app indicates the dot and remote are connected, but it just turns on / off when trying to speak a command.
B01DFKC2SO|3.0|0|March 27, 2017|Great little toy that would benefit by not having to find and enable skills to do everything.|I love my echo dot - it's a great price point, inexpensive enough that I don't feel guilty buying it.  I use it the most for time, timers, stopwatch, weather, shopping list, music and to find my phone.  I have also paired it with a TP Link so that i can turn my bedside table light on/off instead of getting out of bed and walking across the room when i'm ready to go to bed or need a light at night. If it wouldn't be for the stupid skills that need to be enabled for every little thing, it would be 5 stars.  But who wants to find skills and then have to recall the name so that you can direct Alexa to use that skill.  Bad move Amazon.  If (when) google voice provides an entry price point for their Google Home line, the only advantage Alexa will have is ordering off Amazon.
B01DFKC2SO|3.0|0|August 20, 2017|It's super annoying but turns out to be ok enough (if you don't return it first)|Hard to set up: it took more than an hour because the app couldn't coordinate the bluetooth or the wifi, kept crashing or hanging. After restarting the echo, phone and app multiple times, a google search showed that sometimes some part of android needs to be updated for the Alexa app to work. I didn't have that problem but it still took another 45 minutes to set up. The alexa app is the worst. The echo is ok as speakers go, though the bluetooth is frustrating and iffy at best (it once took me an hour to connect my laptop to my Echo because neither the app or the echo could 'find" the computer's bluetooth). It's also super annoying (and not totally clearly stated) that it's not possible to link Echos (or dots) together. Why does all of the Amazon stuff stink? Fussy, hard to use, finicky. The gear from the big G just works and is totally drama free.
B01DFKC2SO|3.0|0|July 23, 2017|Good concept, but poor engineering...|I like the music activation features, but I practically have to yell for Alexa to hear me even though my dot is only 5 feet from my bed. I have a google home in my living room and it activates with my normal voice level from just about anywhere whereas echo dot often needs several repetitions at almost yelling voice levels. Good concept; poor execution by the engineers. Maybe I got a damaged dot, but the volume and voice recognition are poor.
B01DFKC2SO|3.0|0|July 2, 2017|The blue tooth connecting works fine and streaming music is ok|Not exactly what I was expecting. The info is very deceptive on using highlighted features. Making a phone call is almost impossible. The blue tooth connecting works fine and streaming music is ok. Ask about weather is ok. Needs work, the phone app ask  to link contacts and it did not link. Said call home...It just sits there and does nothing. Said call Jessica, it worked 1 out of 7 tries.No learning curve...cause it does not work like advertised.
B01DFKC2SO|3.0|One|May 18, 2017|Its Okay.|Nice and fompact, i like that jt has a jack for headphones or a speaker which i use for it. Comming from the original Alexa the speakers on this thing just fall on their face. Also if your any more than 2 rooms away from your router this thing cannot function because of loss of connection.
B01DFKC2SO|3.0|3|October 31, 2016|I like the original Echo just fine|I like the original Echo just fine. But this device doesn't  sync music or timers with other Echo devices in the house. In my mind, this should be a basic function. Also, Alexa gets confused very easily by basic questions  that are answered quickly using Google Now. Software updates to fix these things should be possible.
B01DFKC2SO|3.0|0|November 10, 2016|Not bad|Well, not that perfect as I expected. It can't always hear you when you are watching TV, or you have any other surrounding sound. It can't hear you if you are talking in a normal voice, you always have to speak a bit louder, like you are calling someone in another room or just far away. It's very limited, even Harmony still can't control the volume. I was just seduced by the price and the form-factor, but overall, the only fun I can get is to turn ON/OFF my TV (and yes, it's nice when it works from the first time, but when you have to repeat 2-3 times the only thoughts you have it like "damn, i'd better get a remote, i look like an idiot talking to a machine that doesn't want to listen". Also, it can't handle simple questions like "Who is the richest actress in the world", while it suggests the Bing link, which has a table of the richest actreeses, it cannot read the results itself and tell it to you. Why would I need to use it to get the link, while I can search from mobile in a seconds. Since I don't use Spotify and other US services, the only useful thing for me is a limited Harmony support. Will try to use IFTTT to see what capabilities it has. I simply don't understand, why not to make an easy interface to make your own "voice command to Alexa -> http/json request".
B01DFKC2SO|3.0|0|April 23, 2017|using it to play music is it's main thing if you don't have a smart home, and creating music playlists is very convoluted|It seems gimmicky to me ... using it to play music is it's main thing if you don't have a smart home, and creating music playlists is very convoluted.  I have tried and tried to get it to just play 'bird sounds' for my parrot,and each time I get a totally different result ...mostly a song that has one of the words in it, and sometimes she 'gets it' and plays amazon bird sounds for me ... I used it for the first few days and now the fascination has worn off.
B01DFKC2SO|3.0|0|July 24, 2017|Jury still out|Sound is not great for music, perhaps the Echo itself is better.  You also cannot sync and voice command with your iTunes library on your phone, only Amazon Music, Pandora, SIRUS XM, and a few others.  It got on a Prime Day deal, so i guess the $35 was worth it, but i wouldn't have been happy if i paid more for it.  I'll rate again at a later date as i've only used a few weeks and haven't ordered from it yet, only asked weather, and controlled music.
B01DFKC2SO|3.0|0|July 22, 2017|Both works fine, with some understanding issues for complex or long ...|We've been using this for 2 scenarios: set-up kitchen timers and read wikipedia for you. Both works fine, with some understanding issues for complex or long sentences. Unfortunately it cannot search on youtube and play songs from there, that would be ideal when you have crunky kids around the house with little patience for you to pick-up the phone and do a search by typing, and, then let them hold your phone, that is a dangerous thing in its own.
B01DFKC2SO|3.0|0|September 19, 2017|I like Alexa, but she needs to smarten up!|I wish Alexa could handle context questions better. Like, "Alexa who was the president in 2000 in the US, or how long should cook an egg to hard boil it" Or who sang this song, and is so and so still alive and what is an orchestra or where is Myanmar?" Also, I have pandora, spotify and prime, yet she can not play a specific song for me, only a sample.  I purchased one for use on our personal care floor, (elderly people) they don't think she knows anything and they can not hear her. :(
B01DFKC2SO|3.0|0|January 3, 2017|Not as smart as Google Home|I got this and the Google Home when they just came out.  I keep the Echo at my parent's house and the Home at my apartment, and use both with smart plugs, smart lighting, Logitech Harmony, Nest, Bose Soundtouch, etc.  After a few months, I can say with certainty I absolutely prefer the Google Home, and think the extra money spent is worth it. PROS: - LOTS of skills, including the TP Link smart devices, which work well - Asks for voice feedback and has voice training to ensure it understands you - Can work with an awesome speaker, like Bose or Sonos -AllRecipes integration, though should work better CONS: - Voice recognition isn't there yet - everyone in my family gets mad at Alexa.  You  say "Turn lights on"  and it starts playing Sara Bareilles..... -You have to ask very specific phrases, whereas if you tweak the phrasing in Google Home, it still knows what you're talking about - A lot of the awesome, obscure skills, but even without account integration, you need to enable them and remember their names.  "Alexa, ask WineBuddy to"'.  You need to remember all the specific commands for them to work All in all, for $50 it's good - but I'd recommend waiting for it to improve or trying another device.
B01DFKC2SO|3.0|0|April 23, 2017|Best when interacting with Amazon services|I returned my large Echo and purchased the Dot other than the speakers it works the same.  But the Echo's have their problems.  Greatly lacking in the information department.  You'll learn not to ask it general question because the response will be "I can't find the answer to the question you ask" or "I don't...I can't...I'm not able".  So pair it with a great Bluetooth speaker and enjoy your amazon prime music
B01DFKC2SO|3.0|0|July 26, 2017|Ok for basics, but needs a lot of work.|It is pretty neat, but could use a lot of work. It only uses Bing to search, I ask for it to play a song, it's not in my music library, so it won't play, when normally I can Google or you tube and have it play. I ask for the weather in my town, but since my internet provider is based out of a town an hour north, it gives me the weather for that town, and I can't set a default for my actual town that I want the weather for. That's just a few minor annoyances I have noticed so far. The pros are that it does have a decent speaker. I know people who wouldn't buy this, but opted for the larger one, as they thought this did not have a speaker... It does, and it's not bad. But you can also sync it by Bluetooth to another Bluetooth speaker, and that works quite well. It's not as useful as I imagined it might be, but I am still a very new user.
B01DFKC2SO|3.0|One|April 14, 2017|Alexa needs work to be a truly useful device. Right now we use it for voice ...|Alexa needs work to be a truly useful device. Right now we use it for voice activated music and to power some smart devices so not much. It's difficult enough to use because you have to memorize all the commands to really benefit from it's full functionality. It's not very intuitive. Still, it's been handy and we've enjoyed having it thus far.
B01DFKC2SO|3.0|0|August 24, 2017|Cool item in need of better speech recognition.|It's a cool item but it need to better understand you.  I find myself yelling at it often because it does not understand what I'm asking it.  Should have better flow like Siri or Google Assistant then it would rock.  Most often I ask it to turn off of on a hue lights and it says sorry many things share this name what did you want....  All I said was turn on or off light 1 only one light has this name!  Or make hue color blue and I get the same response but again only one light is called hue color...
B01DFKC2SO|3.0|2|January 2, 2017|until she found out that she needs to purchase monthly services for everything she'd like to do with the device|Bought this for my teen-aged daughter.  She was very excited, until she found out that she needs to purchase monthly services for everything she'd like to do with the device.  I think Amazon needs to be very clear up front that things like music must be purchased and that other features require special set-up which also cost money. Also, after I purchased this Dot through Amazon, I saw it on sale at several stores locally for $10 cheaper.  Not happy.
B01DFKC2SO|3.0|0|July 27, 2017|Alexa does great with weather and traffic movie show times and restaurants ...|i have been getting answers relating to "I don't know" than answers, cant continue a conversation cant ask follow up question without using the wake up word, could not answer one baseball stat, Alexa signed me up for Amazon Music Unlimited after i inquired if MU had audio books, i immediately told Alexa to cancel order but it referred me to Amazon site to cancel, Alexa does great with weather and traffic movie show times and restaurants questions and measurement equivalents, sq meters to sq ft., tablespoons in cups, kilometers per hours to miles per hours etc  i think there maybe safeguards such as a pin number to use prior to Alexa placing orders if not there should be a better protection, i dint not like having to get up and cancelling an order i don't intend to place, only 3 wake up word choices, the dot  close to the TV is woke up often than i would like and fear it will order something so it stays muted...all  in all i'm satisfied with the dot purchase
B01DFKC2SO|3.0|0|July 23, 2017|Caveat emptor if you're planning on using the Bluetooth function.|I bought the Dot thinking I'd be able to play music from the Dot through my Denon receiver with Bluetooth.  I erroneously assumed this would pair with the Bluetooth receiver, as my research showed that both have the Advanced Audio Distribution Profile (A2DP) and should, therefore, have been compatible.  However, the Dot would not pair with the receiver.  The guy I talked with in tech support confirmed that they would not pair, and said Amazon should change the description to reflect that a device may support the A2DP profile but still not pair.  In order to pair my phone with my receiver, I had to enter a pass code into my phone.  The Dot does not have the capability to do that.  Bottom line is that the Dot doesn't pair with any of my devices.  I had to do a work around by plugging a stereo mini plug into the headphone jack on the Dot with split RCA plugs on the other end into the audio in jacks on the back of the receiver.  Not exactly ideal, as the Dot has to remain near the receiver.
B01DFKC2SO|3.0|0|August 13, 2017|Terrible audio. Unusable without an external speaker.|I mostly listen to streaming news radio, so I don't have high standards for audio quality. I just need to be able to hear people talking. I didn't expect this to sound great, but I thought it'd be at least as good as the speaker on the average smartphone. It works fine as an Alexa device. If you want something to tell you the time, or weather forecast, or to order more paper towels from Amazon, these are perfectly okay. But if you plan on listening to radio/music/etc., you need to order an external speaker to go with it.
B01DFKC2SO|3.0|0|July 24, 2017|TLDR; it works well, but they don't play well with others...yet?|Well, it does connect to the internet, it does respond to voice control, and it does what it says it's supposed to do.  My hope was to set up a system in conjunction with VAUX speakers that would allow for music to play throughout my home via simple voice commands.  Alas, these don't talk to one another very well.  Each Echo/Echo dot should be considered a silo entity; they don't pick up where one left off, at least not as of yet.  Connectivity is decent, though sometimes playback gets cut off sometimes.  I think that may have more to do with my home bandwidth or something rather than the device functionality.
B01DFKC2SO|3.0|One|December 12, 2016|PROBLEMS WITH ECHO DOT|I live in usa but since I was travling abroad my y son had bought it for me. Since instalation I have few problems. -CANNOT ADJUST TIME ZONE EXCEPT USA TIME If i ask about the time it will always say the time of Seattle. I tried to change it to uk time or pakistan time but  I could not. So I feel it is only made for USA and cannot be taken abroad. It will be useless in other countries. -I WANT TO PLAY MUSIC STORED IN MY IPHONE 6PLUST through the command given through ALEXA to BOSE , SOUND LINKMINI, BUT I CANNOT. I HAVE TO PLAY WITHOUT INVOLVING THE ECHO DOT directly from iphone to soundlink mini without alexa. IF SOME ONE CAN HELP I WILL APPRECIATE DR SHAHID ABBAS
B01DFKC2SO|3.0|One|February 4, 2017|Amazon tried too hard.|I'm happy enough with the product, but Amazon lost two stars because they made too many assumptions.  I had purchased this as a gift using Amazon Prime, but it didn't even ship for two days. Days after giving it to the recipient (already late), I noticed in my Alexa app that the new Echo Dot had automaticallt been registered to my account, but it wasn't intended to be mine!. After all, it's a voice controlled device so the app isn't needed unless you're making changes like adding a Wemo.  I might not have noticed this for months!  I hope this wasn't the cause for problems he had setting up his Echo.  He asked me for help setting it up a full month after I have it to him.
